{
  "$schema": "schemas/roadmap.schema.json",
  "version": 1,
  "updated": "2026-09-25",
  "claim": {
    "text": "Anyone can mint an artist's Degent from degent.club; the artist is paid 10% of the mint price on chain inside the minter's own funding transaction; the house never holds either party's keys or money",
    "measure": "A signet mint of an artwork order whose funding transaction pays the artist output and the club output, whose reveal is co-signed by the policy signer, and whose block.space attestation lists the artist and edition",
    "reproduce": "pnpm --filter @bsh/degent-mint test -- e2e  # artwork order to delivered with the studio fake receiving the royalty record"
  },
  "repos": {
    "degent": {
      "url": "https://github.com/DegentClub/degent",
      "role": "this repo: mint service, studio service, mint SDK, web app"
    },
    "platform": {
      "url": "https://github.com/DegentClub/scribbit",
      "role": "@bsh/inscription attribution, @bsh/ledger payees and psbt method, @bsh/signer, @bsh/events AMQP"
    },
    "blockspace": {
      "url": "https://github.com/DegentClub/blockspace",
      "role": "certification with attribution (ADR-0008)"
    }
  },
  "phases": [
    {
      "id": "p0",
      "name": "Stabilise",
      "exit": "Strict 0x81 reveals in service and web, CI runs on every push, large-reveal tests never time out.",
      "items": [
        {
          "id": "p0.1",
          "repo": "degent",
          "title": "0x81 reveals with pre-committed parent return, user-held rescue key (ADR-0005)",
          "status": "done",
          "verify": "pnpm --filter @bsh/degent-mint test",
          "doc": "docs/adr/0005-strict-reveal-and-tiers.md"
        },
        {
          "id": "p0.2",
          "repo": "degent",
          "title": "Recovery bundle v2 and local rescue in the web app",
          "status": "done",
          "verify": "pnpm --filter @bsh/degent-web test"
        },
        {
          "id": "p0.3",
          "repo": "degent",
          "title": "CI on claude/** pushes; CODEOWNERS check passes --org DegentClub",
          "status": "done",
          "verify": "pnpm --filter @bsh/catalog-tool run codeowners --check -- --org DegentClub"
        },
        {
          "id": "p0.4",
          "repo": "degent",
          "title": "120 s test budget for Full Block and Large Degent reveal tests",
          "status": "done",
          "verify": "pnpm --filter @bsh/degent-mint test"
        }
      ]
    },
    {
      "id": "p1",
      "name": "Degent rules as code",
      "exit": "Square, JPEG-recommended and size rules enforced by the SDK; vision review is Degent-specific and never approves on a skipped check.",
      "items": [
        {
          "id": "p1.1",
          "repo": "degent",
          "title": "validateContentMeta square check; recommendedContentType and formatAdvice",
          "status": "done",
          "verify": "pnpm --filter @bsh/degent-mint-sdk test"
        },
        {
          "id": "p1.2",
          "repo": "degent",
          "title": "degent-rules.ts data + contracts/schemas/degent-rules.json agree",
          "status": "done",
          "verify": "pnpm --filter @bsh/degent-mint-sdk test -- degent-rules"
        },
        {
          "id": "p1.3",
          "repo": "degent",
          "title": "Degent-specific vision guidelines; skipped review => needsHuman, never approved",
          "status": "done",
          "verify": "pnpm --filter @bsh/degent-studio test -- review"
        },
        {
          "id": "p1.4",
          "repo": "degent",
          "title": "Review corpus fixtures: zero false approvals, every rejection has a reason",
          "status": "todo",
          "depends_on": [
            "p1.3"
          ]
        },
        {
          "id": "p1.5",
          "repo": "degent",
          "title": "Web app shows the format advice and the five rules from the SDK data",
          "status": "done",
          "depends_on": [
            "p1.1",
            "p1.2"
          ]
        }
      ]
    },
    {
      "id": "p2",
      "name": "Artist Studio",
      "exit": "An artist signs in with a wallet, proves a payout address, uploads, gets a verdict with reasons and is listed; every response validates against the contract.",
      "items": [
        {
          "id": "p2.1",
          "repo": "degent",
          "title": "Contracts: contracts/openapi/degent-studio.yaml, contracts/asyncapi/degent-studio.yaml",
          "status": "done"
        },
        {
          "id": "p2.2",
          "repo": "degent",
          "title": "Sign in with Bitcoin via @bsh/identity; session with scope artist",
          "status": "done",
          "verify": "pnpm --filter @bsh/degent-studio test -- auth"
        },
        {
          "id": "p2.3",
          "repo": "degent",
          "title": "Payout address proven by BIP-322 simple signature; legacy refused",
          "status": "done",
          "verify": "pnpm --filter @bsh/degent-studio test -- payout"
        },
        {
          "id": "p2.4",
          "repo": "degent",
          "title": "Artworks: submit, upload, review once, gallery, content endpoint, delist, house review, feature",
          "status": "done",
          "verify": "pnpm --filter @bsh/degent-studio test"
        },
        {
          "id": "p2.5",
          "repo": "degent",
          "title": "Royalty view and internal royalty record endpoint",
          "status": "done"
        },
        {
          "id": "p2.6",
          "repo": "degent",
          "title": "Memory and SQLite stores with parity tests",
          "status": "done"
        },
        {
          "id": "p2.7",
          "repo": "degent",
          "title": "ADR-0007 Open Studio",
          "status": "done",
          "doc": "docs/adr/0007-open-studio.md"
        },
        {
          "id": "p2.8",
          "repo": "degent",
          "title": "Web: artist sign-in, upload, status, gallery page",
          "status": "done",
          "depends_on": [
            "p2.1",
            "p2.4"
          ]
        }
      ]
    },
    {
      "id": "p3",
      "name": "Open mint with royalty",
      "exit": "A signet mint pays the artist and the club in one funding transaction, the reveal is co-signed, the ledger receipt matches the chain, and a rescue after an outage leaves the artist paid.",
      "items": [
        {
          "id": "p3.1",
          "repo": "platform",
          "title": "@bsh/ledger: payees on line items, psbt payment method, payout records, ledger.payout events, refund race fixed",
          "status": "done",
          "verify": "pnpm --filter @bsh/ledger test"
        },
        {
          "id": "p3.2",
          "repo": "platform",
          "title": "@bsh/inscription: encodeAttribution/decodeAttribution (CBOR metadata)",
          "status": "done",
          "verify": "pnpm --filter @bsh/inscription test -- attribution"
        },
        {
          "id": "p3.3",
          "repo": "platform",
          "title": "collection.minted gains artist, artworkId, edition, royalty (minor bump)",
          "status": "done",
          "depends_on": [
            "p3.1"
          ],
          "verify": "pnpm --filter @bsh/events test"
        },
        {
          "id": "p3.4",
          "repo": "degent",
          "title": "Pin bump to the platform commit carrying p3.1-p3.3 (09bd9d7: ledger 1.2 observations, collection.minted 1.1.0)",
          "status": "done",
          "depends_on": [
            "p3.1",
            "p3.2",
            "p3.3"
          ],
          "verify": "pnpm check"
        },
        {
          "id": "p3.5",
          "repo": "degent",
          "title": "Contract: CreateOrderRequest.artworkId, Quote/Order royalty fields, ServiceConfig bps, new error codes, royalty.paid channel",
          "status": "done",
          "depends_on": [
            "p2.1"
          ],
          "doc": "docs/open-studio-plan.md",
          "verify": "pnpm --filter @bsh/degent-mint test -- contract"
        },
        {
          "id": "p3.6",
          "repo": "degent",
          "title": "Orders from artworkId: content from the studio, review skipped, edition reserved at quote",
          "status": "done",
          "depends_on": [
            "p3.5"
          ],
          "verify": "pnpm --filter @bsh/degent-mint test -- artwork-orders"
        },
        {
          "id": "p3.7",
          "repo": "degent",
          "title": "Funding PSBT outputs [commit, artist, club, change]; post-sign check covers scripts and values; dust raise",
          "status": "done",
          "depends_on": [
            "p3.5"
          ],
          "verify": "pnpm --filter @bsh/degent-web test -- funding"
        },
        {
          "id": "p3.8",
          "repo": "degent",
          "title": "Worker verifies artist and club outputs by script; assigns edition; emits royalty.paid; posts to the studio",
          "status": "done",
          "depends_on": [
            "p3.6"
          ],
          "verify": "pnpm --filter @bsh/degent-mint test -- royalty-worker"
        },
        {
          "id": "p3.9",
          "repo": "degent",
          "title": "Attribution metadata in the envelope; collection.minted emitted with royalty fields",
          "status": "done",
          "depends_on": [
            "p3.4",
            "p3.6"
          ],
          "verify": "pnpm --filter @bsh/degent-mint test -- artwork-e2e"
        },
        {
          "id": "p3.10",
          "repo": "degent",
          "title": "Ledger recording: order with payee line items, psbt intent, funding observation, payouts, receipt",
          "status": "done",
          "depends_on": [
            "p3.4",
            "p3.8"
          ],
          "verify": "pnpm --filter @bsh/degent-mint test -- royalty-worker"
        },
        {
          "id": "p3.11",
          "repo": "degent",